title,nutrition
"Did you know that yogurt and milk have the same amount of sodium? However, milk isn't salty one bit, and yogurt is salty as heck.",1
Question about nutrition,1
Is Keto more popular among the lower middle class?,1
"Sodium, Water Retention, and Aldosterone",1
"Does using ""healthier"" oils (like avocado or coconut) for frying really make a difference?",1
Anyone noticed caloric restriction is very popular among the lower class,1
Confused about high cholesterol?,1
How much variation in diet is ideal?,1
Is it okay to have fermented vegetables with meat?,1
What is the best way to eat veggies?,1
Is Matcha tea healthier than Green tea for the brain?,1
Is arsenic in rice something to worry about?,1
I want to gain weight. Is there an upper limit to the number of calories I can safely consume in one day?,1
What to eat/drink to help with chronic diarrhea nutrient loss?,1
Dog food for humans?,1
Aren’t we all in some from of Ketosis?,1
Sources of Almost Exclusively Soluble Fiber?,1
Is protein important?,1
Liquid multivitamins vs pill multivitamin,1
Radishes vs. beets,1
"[Question] Lutein, lycopene.. what else?",1
"Low calorie food That makes u feel full ,for breakfast and lunch ?",1
Would like advice on weight gain/healthy eating,1
Is beef and chicken in fast food restaurants is processed meat .?,1
"Science Friday: News in Nutrition (January 25, 2019) For discussion on the latest news and research in nutrition science",1
Is vegetable protein really worse than animal protein?,1
Newbie here,1
Breakfast,1
"If I toss my oats in with my milkshake in the morning, am i still getting the fiber?",1
WEETABIX,1
Is Chickpea Pasta Any Different Than Regular Chickpeas?,1
Substitute for Tuna?,1
Anyone know what apple cider vinegar + raw unfiltered honey gives better sleep?,1
Does anyone else hate the taste of fat on meat?,1
Favorite protein bar?,1
Does thawed winter squash soup keep its nutrition?,1
Green tea is amazing for its brain benefits but it just doesn’t taste good. Green Mint tea on the other hand tastes amazing. But does it have the same benefits? (specifically for the brain),1
question,1
Headaches when cutting back?,1
Is garlic and onion actually bad for you?,1
Orange Triad Multivitamin,1
Is whole-meal bread means = whole grain ?,1
opinions on OMAD,1
Just now learning about the FODMAP diet and I’m wondering about supporting evidence along with thoughts about it.,1
"""Nothing is unhealthy if you burn it"" - True?",1
Is my calorie count and macros good for weight loss?,1
"My colleague is using Herbalife, I think it's overpriced. Can someone with knowledge and expertise give some insight?",1
A 'normal' eating pattern?,1
Is mineral water such as Perrier a good substitute for soda?,1
Nutrition Ed in High school,1
Nutritionists title...,1
What would be the maximum about of omega 6 per day to consume through nuts?,1
Dr. Gundry is selling people a bill of fake goods,1
How rare is selenium deficiency?,1
"Does anyone know any reddit pages where they exclusively talk about scientific journal articles on health, nutrition, medicine, exercise etc? As opposed to journals mixed with anecdotes and rhetoric.",1
Vitamin B1 (thiamine) issues,1
Do air fryer reduce the number if calories?,1
Is pregnancy craving doing any harm,1
If PFOAs are so dangerous why are they present in waterproof winter jackets?,1
Is frequent alcohol more unhealthy than frequent junk food?,1
Calcium intake,1
Is wild caught salmon specifically linked to any age associated diseases?,1
"Is it less healthy to fry cheese in a pan (without any added ingredients) than to eat the cheese straight out of the fridge? If so, why? Nothing is added. If anything, some oil is removed during the frying process.",1
HOW do you accurately estimate calories added from deep frying?,1
"A bit of a weird one, but if you could only eat 3 items of food a day for 30 days what would it be?",1
Energy drinks sugar free,1
How does sugarfree energy drinks affect your diet?,1
Food grade epsom salt as a dietary supplement - is long-term use safe?,1
[QUESTION] Is it possible that I see my body reacting to what I eat in a matter of days ?,1
"Nutritious, but chemically suspect food",1
What are some ingredients you should really try to avoid?,1
Is there an evidence-based type survey for eating habits that I can take on a periodic basis for myself?,1
What would a chronic high salt diet result in?,1
Chicken or fish - which is healthier?,1
Delayed reaction to food - is there such a thing?,1
Is it safe to eat non pre-cooked salmon from a can?,1
What would be a good go-to grocery list?,1
Is this healthy?,1
Becoming a registered dietician with a Kinesiology degree,1
"What are some healthy, low trans-fat, low sat-fat, low sodium snacks to snack on?",1
What non-obvious foods have the *least* benefit?,1
How healthy are spices?,1
Is eating protein alone better than eating protein and vegetables?,1
Top Fitness Mobile and Desktop Apps,1
"If i ate lots of carbs (~150g) in the morning, would i still gave glycogen stored in my muscles fir my workout 8 hours later?",1
Vitamin D deficiency questions.,1
Food as catalyst for nervous system states?,1
"I drink soft drinks. What are the best to buy - diet, no sugar, etc? Are any of them really healthy?",1
"Science Friday: News in Nutrition (December 14, 2018) For discussion on the latest news and research in nutrition science",1
Is there a substitute for salad?,1
Question about RDI of nutrients,1
Magnesium bioavailability question,1
How much do nutrition needs really very between sexes?,1
Are there specific foods you'd recommend women with hormonal imbalances causing delayed periods?,1
Plastic Exposure,1
"Are there better, low-carb alternatives to white rice?",1
how much vanilla extract is safe per day?,1
Nutrition Expert Interested in Helping Create Diet Tool?,1
Are there any foods you should NEVER eat?,1
Good healthy detox water?,1
Macronutrients of grass fed New York steak,1
what is the most accurate formula/online calculator to estimate how many calories I need to consume per day to maintain weight? Thanks guys,1
Wife not eating,1
Best Calcium Magnesium supplement (for sleep)?,1
The safest food sources,1
"I’m having intense sugar withdrawals, has anyone else experienced this?",1
Vitamins that increase protein synthesis,1
What does the evidence say for Carnivore or Zero Carb?,1
Nearly always feel flushed/slightly feverish/tired. Suspect anxiety or diet is the cause but so frustrated,1
whats the best way to learn about nutrition from the basics to more advanced,1
Starting point for teaching someone nutrition basics?,1
Acid reflux?,1
Does anyone know why Kroger took out Vitamin D from their Greek Yogurt?,1
Sugar consumption,1
Olive oil calorie monster,1
Insane nosebleeds after eating flaxseeds for the first time.,1
What is the big deal about Kale?,1
Blood work,1
which foods are so healthy that you think everyone should add them to their daily diet?,1
"Can one ""destroy"" fiber in leafy greens like kale/spinach leaves with a Vitamix by blending too hard?",1
Core water vs BodyArmor drink?,1
Does cooking sauces/stews with meat and other animal products (like bones and fat) increase the overall saturated fat and cholesterol of the sauce/stew itself?,1
How much is too much water,1
Any way to replace missing enzymes and help body to digest fat in foods ?,1
Probiotic content in low fat and high fat Greek yogurt.,1
"I'm putting mustard seeds on my cooked cruciferous veggies for the myrosinase activity. If I crush up the seeds and make a mustard out of them, will the enzymatic activity last if stored in the fridge for several days?",1
Winters coming.. What can we eat to prevent sickness?,1
Emotional Eating,1
Cons of milk?,1
Is it better to overeat or undereat when the goal is athletic performance?,1
"Whey protein powder, how much is too much?",1
Suger free Soft drinks and labels,1
Am i fat?,1
Am i skkinny???,1
Custom Tailored Nutrition Plans,1
"The /r/Nutrition Personal Nutrition Discussion Post (December 17, 2018) - All personal circumstance questions and evals pretaining to what you eat or might eat must use this post",1
Vegetable diets,1
Is reheating Quinoa potentially hazardous in the same way as reheating rice is?,1
"Health and nutrition wise, which oil would you suggest cooking with when it comes to scrambled eggs?",1
How long does it take for bodily stores of Omega-3 to deplete after stopping supplementation?,1
"Is it better to eat fresh curcumin or to use it in powder form? I want to make a daily health drink with turmeric, ginger, lemon and pepper but am unsure of the right amount and form of ingredients.",1
Can you get diabetes in one day,1
Is honey healthier than sugar?,1
Should left-overs be reheated?,1
Zero Water Filter,1
Shakes &amp; Hiccups,1
Eating Aloe Vera,1
Is fortified wholemeal bread an option for boosting iron intake?,1
Sources of caffeine?,1
My tomato soup has 16 grams of sugar in it. Sixteen freaking grams!! WTF?,1
Broccoli is 7 weeks old and hasn't changed colour even a little bit. Is this normal?,1
questions about dairy and cancer,1
High Iron Cereals in Canada,1
Advice: Diet whilst injured,1
Do you need both fruits and vegtables for a healthy diet?,1
"Does the body react differently to carbs or a moderate to ""large"" intake of carbs suddenly if you've been eating mostly ketogenically?",1
"Does the body react differently to carbs or a moderate to ""large"" intake of carbs suddenly if one has been eating mostly ketogenically?",1
Magnesium citrate 200mg tablets containing 40mg of elemental magnesium. Which one goes towards my RDA?,1
Is there a way to eat that specifically targets and increases facial fat? (without making you fat all around),1
"What other ""forums"" about Nutrition/Supplements would you recommened?",1
A friend told me that you can cover all of your micronutrients with only carrots and broccoli. Is this true?,1
Is 100 g of protein daily too much for a man (like me)?,1
3.7 L of water a day? Could that be right?,1
"Question about olive oil in cans of sardines or smoked oysters: do you count the total calories listed on the can... or deduct for all the oil left behind if you hardly eat any of the oil? They don't provide a net/total count, so not sure.",1
Fruit juice with no added sugar - good or bad?,1
"Salt, how does it work?",1
Is all meat/flesh bad for you?,1
Do some people need to supplement vitamin d around this time of year?,1
"Just started Keto, going to pick up some kind of supplement for electrolytes. Anything else I should consider?",1
"Is salt in premade spices, chips, pickles, etc iodized?",1
Exercise induced seafood craving?,1
Am I missing a significant amount of nutritional contents by consuming ginger tea versus eating ginger whole?,1
General Wellness/ Nutrition Advice,1
Which kind of diet is the latter of the two?,1
Basic lipid profile says high cholesterol. Looking to get advanced testing done.,1
What’s the most sugar you binged in one day?,1
"Simple meal plans that will check every ""Daily Nutritional Checklist"" box ?",1
What are you thoughts on Huel?,1
How do you get enough protein in your diet??? [x-posted tone/loseit],1
If following a low glycemic food strategy is it bad to have small snacks between meals? Does the type of food matter more than when as long as not going over total caloric intake?,1
Why does organic almond milk have less calcium than regular?,1
What is the best (free) Database for nutrition information?,1
What all-natural options are there for increasing mood?,1
Lectins- going lectin free for a few weeks to see if my gut can heal and my arthritis subside. I have a question: is tomato paste lectin free?!,1
Does tomato paste have lectin?,1
Why is it better to eat sugar with fiber?,1
Longevity focused diet: my friend told me I am risking my heart health w/ fats (Cronometer attached),1
Is it better to have high fat or high carb for a longevity based diet?,1
what seems to be the general consensus regarding artificial sweeteners?,1
"is there any point you get to where a ""cheat"" meal is adverse for you",1
Is Hershey 100% Cacao Raw cacao?,1
What are some non-bullshit YouTubers regarding nutrition health?,1
Avoiding estrogenic foods (dairy),1
What is it about eating healthy foods that makes everyone smug?,1
Ideal Diet for Female Hormone Balance,1
"In light of the “non-bullshit” question posted earlier, what is some common bullshit about nutrition floating around the internet?",1
How much sugar in 1g of starch?,1
"Are there any major health concerns with doing ""omad"" one-meal-a-day eating?",1
"Chia Seeds, False Positive Drug Tests?",1
I searched about this everywhere...,1
What's the best vitamin to take for overall good health ? And what are the need to know benefits of the vitamins themselves ?,1
small nipples,1
How bad is drinking black tea after a meal ?,1
If you could eliminate one thing from your diet to make the biggest impact for YOU what would it be?,1
"fiber doesn't ""exist"" in juice?",1
Confused on how to proceed with calorie intake.,1
How to help husband lower his cholesterol?,1
Calories and nutrients,1
Can there be any nutrients that we havent discovered yet but our body needs them?,1
Broccoli sprout freezing question,1
Daily Diet,1
Cooked drinks,1
Upset Stomach/Digestive Issues,1
Algal Oil vs. Fish Oil,1
Meats and Greens,1
Meats and Greens,1
Animal Meats and Vegetables,1
Sugar and carb intake,1
"Science Friday: News in Nutrition (December 21, 2018) For discussion on the latest news and research in nutrition science",1
Delayed satiety?,1
Any way to compensate for low omega 3 intake?,1
Dinner of champions: (frozen lasagna+raw sugar cookie dough+PBR tall boys)=gainz,1
Weekly calories,1
Is magnesium glycinate a chelate? There’s so many forums and not many articles examplibg the difference,1
what does b12 actually do in the body?,1
How wood you rank the berries?,1
Diet composition and storage of fat on the body?,1
[other] please give me some sugar facts that will make me detest it. PLEASE!! Help me keep up my willpower!,1
Please give me some sugar facts put into context that will make me detest it. PLEASE! I NEED THE WILLPOWER!,1
My fiancee stopped drinking milk and now she has really bad stomach pains,1
How much is too much?,1
Hydroponics!,1
Is Numbeo's Recommended Minimum Money for Food inaccurate or is nearly everyone including the upper class in my country all suffering from malnutrition?,1
Can Whey Protein increase IGF-1 levels?,1
Kidney Disease and Protein,1
Food culture - an overlooked side of nutrition?,1
MPS (Muscle Protein Synthesis) during a fat-loss period,1
Too much insoluble fiber?...,1
Question about decaf coffee,1
Healthiest sweetener?,1
Should sugar be avoided more then fat? What do you think of this video?,1
Diets in non-western countries...,1
Eating carbs and fat at different times,1
The Least Dense Bean,1
Is it safe to eat bruises on strawberries?,1
"How many calories from fat does fiber ""block""?",1
Best diet (and exercise) including a large amount of alcohol,1
Is the copper content of beef liver more detrimental to health than the Vitamin A (retinol) content?,1
What are your favorite low or no sodium dried herbs and spices?,1
Seekig foods with high water content,1
For anyone who has bad digestion/stomach issue eat this.,1
What does 100% daily value look like?,1
Cooking fish (from frozen) in microwave,1
scared of soy,1
Can someone tell me where every nutrient/vitamin gets digested/absorb?,1
Really bad magnesium deficiency or something else?,1
Personal Nutrition Services?,1
Absorption of quercetin,1
What vitamins are the most important to take for small eaters?,1
Do the nutrition labels include everything in the item or just the main food?,1
Could you get zinc toxicity when zinc deficient? and why?,1
Nutrient search tool for Glutamine at USDA database,1
Is Air Frying bad for you ?,1
Are vitamin supplements safe to take?,1
"The /r/Nutrition Personal Nutrition Discussion Post (December 24, 2018) - All personal circumstance questions and evals pretaining to what you eat or might eat must use this post",1
Is it okay to go over 1000ug for folate consistently?,1
"Can a person safely live only on complete meal replacements (Soylent, Keto Chow) for an extended period of time?",1
Can big amounts of unrefined carbs contribute to health problems?,1
Vegetarian,1
Probiotic/enzyme causing diarrhea?,1
Does vitamin “E” supplement really help in teams of hair fall and eye health?,1
A framework for general good nutrition?,1
What fruits paired with almonds and sunflower seeds will keep me fuller for longer?,1
I can't eat rich foods after dieting,1
"100% juice, yet no vitamins in it. Why?",1
"""Clean Bulking"" : How much dietary fat?",1
Are iron supplements better absorbed with natural vitamin c or synthetic ascorbic acid?,1
Is this a healthy breakfast?,1
"Proper nutrition (including vitamins/minerals/supplements) used to help prevent diseases is applauded, while intense nutrition to treat disease is called quackery?",1
Health pros/cons of liverwurst,1
Reverse diseases of the civilization eating the right food,1
Are Fruit Milkshakes bad for you?,1
"Blacksea has a lot of plastic waste, if we eat fish in that region, does it cause cancer?",1
Healthiest way to cook vegetables?,1
I have a lump on my thyroid and now everyone is trying to give me iodine,1
"If i had the option to choose between 5 or less natural foods to eat for the rest of my life and still be healthy, which would they be?",1
Are there any good reasons why I should continue to drink dairy milk over almond milk?,1
How much cocoa is just enough and not too much?,1
Recommendations on books to learn Fundamentals of Clinical Nutrition,1
Why is it that I stay fuller longer after eating an unhealthy meal compared to a nutritious meal?,1
Thoughts on using Protein Powders?,1
Nutritional analysis of coconut water?,1
"Iron in cereal and iron in plants, are they the same?",1
"I've been doing some research on fatty acids, and I need some help.",1
Fats and how to consume them?,1
Got my test back which shows my food sensitivities. What do I eat now?,1
Nutrition for strength training.,1
How can you maintain fitness and nutrition while doing shift work and constantly cycling from nights to days?,1
Does the nutrition in egg change depending on how it's cooked?,1
I’ve lost almost 45kg (100ish pounds) and am struggling to lose the last bit... I’m on 1200 calories a day - should I lower this even more? I do a mix of both strength and cardio - mainly strength training. Any advice? Thanks!,1
Are these to good to be true? Every other lentil I see has at least 100 calories a serving at 32 g dry.,1
Bulk up,1
Are flax seeds bad for people with endometriosis?,1
Is drinking 1 gallon of water throughout the day better than drinking 1 gallon within an hour?,1
"If I ingest Para-aminobenzoic acid via natural sources, does the Para-aminobenzoic acid go to my bloodstream or get destroyed during digestion?",1
Is the “standard American diet” standardized across trials?,1
Can dairy cause bad breath?,1
How does a high sodium diet cause kidney stones?,1
What are some nutrition tips or information that you have learnt this year or through this sub?,1
How do you prevent uric acid stones while following a high protein diet for bodybuilding?,1
Why are pre workouts so crazy?,1
Nutritional quality of pressed tomato,1
Why do we have dessert?,1
What's the longest you've fasted for and what were the results?,1
"For those of you who got their undergrad in Nutrition and went on to pursue something different, what did you pursue? Did any of you decide to get more involved with science and pursue biochemistry or physiology?",1
What happens inside your body when you eat a large salad?,1
"If you had to eat 1000 kcal, not 1 more, what would you eat?",1
Are we overcomplicating nutrition and are there any blanket nutritional statements that can be made about what is good or not?,1
Is gummy shark healthy for you?,1
Water Flavor Enhancer with OUT Citric Acid,1
"Is 200mcg of vitamin B12 ""Methylcobalamine in my whole food multivitamin too much B12?",1
How harmful is it really to be underweight in your 20s?,1
Question about soaking seeds/nuts,1
"Science Friday: News in Nutrition (December 28, 2018) For discussion on the latest news and research in nutrition science",1
Question about iron RDI.,1
‘Amazing Grass’ supplements,1
Proper fruit portions,1
What would be the best nutrients to check for deficiencies in pregnancy??,1
Only one ingredient but has added sugars?,1
"When do you feel the lowest energy? And, how do you combat this?",1
Calorie counting question that nobody seems to have answered,1
Is my frozen Kale safe to eat without blanching?,1
can you get too much folate from food?,1
Clenbuterol,1
Starting to eat meat again,1
Is fat really that bad?,1
How to cut down on sugar intake,1
"Is the oxalate content of TVP/soy protein isolate worth worrying about? If so, would calcium citrate help?",1
Questions about hydration and urination frequency?,1
"Why are there so many people who can't digest grains anymore, and more food allergies and sensitivities than there used to be?",1
Vitamin D from Skim Milk,1
Some questions for anyone who follows the OMAD diet,1
I'll be doing a presentation for young teenagers in a group environment. Help me think of interactive activities?,1
How to sustain weight while having vegetarian diet?,1
The sausage question,1
Nutrition books / guides,1
How do you interpret this food label?,1
How much honey is too much honey to eat in one go?,1
Okinawan vs NutritionFacts diet,1
For those of you who prefer ORGANIC...Starting a new SUB,1
Does distilled water actually pull potassium out of cells?,1
"Potential ""Downside"" or Dangers of Canned Chicken Breast (vs. Canned Tuna)",1
Vitamin D in ice cream?,1
Excessive sleepiness with vitamin d3 prescription,1
Does sequential eating or order of eating hold any merit?,1
[Dietary carbohydrate intake and mortality: a prospective cohort study and meta-analysis](https://www.thelancet.com/journals/lanpub/article/PIIS2468-2667(18)30135-X/fulltext),1
Dietary carbohydrate intake and mortality: a prospective cohort study and meta-analysis,1
[Research Discussion] Dietary carbohydrate intake and mortality: a prospective cohort study and meta-analysis,1
Thoughts on sugar free candy?,1
Properly consuming lemons for Vitamin C or any other health benefits.,1
Iron &amp; vitamin D rich foods,1
podcast?,1
Bioavailability of Vitamin D3 &amp; B12,1
Calls to eliminate nitrite preservative in UK,1
"Beans, Beans, Beans",1
Triathlon training nutrition,1
How to digest citric acid?,1
"Help working out macros, please?",1
Looking for a guide for a six pack diet,1
Which genetically modified foods are safe to eat? Which aren’t? Are GMOs even bad?,1
More recent Ancestral diets?,1
"Are there any websites or resources that you can input your diet into, and get back the amount of vitamins and minerals you took in?",1
Is dextrin counted as sugar on nutrition labels?,1
Gluten intolerance confirmation bias?,1
High calorie bulking in instapot,1
Question about beans,1
"Trying to drink more water, need to pee alot afterwards",1
"The /r/Nutrition Personal Nutrition Discussion Post (December 31, 2018) - All personal circumstance questions and evals pretaining to what you eat or might eat must use this post",1
Working out calories and macros?,1
Is glutamate unhealthy?,1
Bulking Clean,1
"Can someone 400+ lbs eat 2,000 calories a day safely to lose weight?",1
Seeing an Endocrinologist Vs. Nutritionist,1
Paleo vs. Keto,1
Question about food cravings,1
Question about popcorn,1
Creditentials,1
Why do many frozen vegetables have zero nutritional value labeled?,1
Best Books to study for the Registered Dietician (RD) exam,1
Why do alcoholics or druggies have bad skin/hair?,1
milk consumption,1
Is it possible to gain “healthy” weight through a healthy diet alone?,1
Which foods are high in vitamin/nutrients?,1
Is Nutrisystem food healthy,1
What’s the healthiest way to cook an egg?,1
"Is eating ""junk food"" bad for your health if you consistently workout and get your other key macros/micros?",1
Renal diet question,1
Benefits of Orgain Plant-based Protein Powder?,1
Foods To Eat To Promote Hair Growth,1
How do you balance your Omega 3/6 ratio?,1
I made a graph: Protein per 100 calories,1
Tips For Portion Control?,1
Zero Energy - What can be done to help?,1
question about washing potato,1
Nutritional value of non foods?,1
Who would I need to go to plan daily diets?,1
My friends guide to being nutritious in the South,1
Too much vitamin A from diet?,1
"When in a surplus and have exercised, does your body prioritize muscle growth. (Is there a huge ratio difference between muscle growth and fat?)",1
the perfect meal?,1
Highest iron intake,1
What is a good celebratory meal that is still healthy?,1
I've accidently made myself lactose intolerant,1
Taking Beta Alanine as an OCD / Depression sufferer?,1
About eggs and cholesterol,1
What to do with fruit/veggie pulp left over from juicing? Also what are some good ways to more fiber in diet.,1
Is the 6-8 cups of water rule per day in response to increased salt and sugar intake?,1
Does microwaving food kill nutrients? (or anything else beneficial to health),1
Lettuce vs Rice,1
Spinach vs. Broccoli Sprouts?,1
WoE transition suggestions,1
Does oat flour lose the nutrients of oats in the process of making it?,1
Why are multivitamins suggested to not be enough?,1
Is sulcrose bad for health,1
What's the science's standing on veganism and vegetarianism?,1
Is there anything fresh that is better then frozen nutritionally?,1
Downsides of eating too much tinned food?,1
Thoughts on the nutrition of lab-grown meat?,1
Diet to Change Cholesterol?,1
Calorie Apps,1
Easiest foods to digest?,1
Easiest foods to digest?,1
Minimum nutrition checklist,1
Is eating sugar before a workout still bad for you?,1
Is weighing food really a nuisance?,1
Does occasionally fasting for a day really help?,1
