title,nutrition
"Nutritionists,what softwares do you use for meal planning?",1
Top 5 vitamins,1
The lack of objective truth in nutrition,1
Can proper nutrition protect you from the harmful effects of a sedentary lifestyle?,1
Could this nutritional information be legit?,1
Doctor told me to avoid eating egg yolks because I have high cholesterol. Is he right?,1
Is taking vitamin D during fall and winter ok?,1
What vitamins should every adult take on a daily basis?,1
Canola oil linked to worsened memory and learning ability in Alzheimer's,1
Glaceau Vitamin Water - Basic Nutrition Query,1
How many of you who are lifting and (clean) bulking actually get less than 300 mg of cholesterol a day?,1
Is it true that you can become lactose intolerant out of nowhere?,1
Sugar free tomato soup?,1
Probiotics,1
Removing fat from peanut butter?,1
Why is cola capable of making one incerdibly horny and sensitive to arousal?,1
Can someone tell me how many calories are in this chocolate from Kazakhstan?,1
Fun question!,1
For those who track calories...,1
Is there anything that shows about how much nutrition is lost when you cook the vegetables?,1
what is your favorite thing to snack on during a cutting phase?,1
I wanna have a discussion about complex carbs vs simple carbs vs sugar,1
Is drinking a lot of water after a meal bad for digestion?,1
"People who regularly take in your recommended amount of potassium, what does your diet tend to look like?",1
Is 1500kcal/day significantly different than 3000kcal ADF?,1
Is rice more nutritious after draining the water after boiling?,1
What are your favorite low calorie snacks that satisfy your cravings?,1
Veggie dip,1
If you were to eat a meat only diet how would you eliminate waste?,1
What do you guys think of carrot juice?,1
Advice on processed meats,1
Why do digestive enzymes relieve bloating/flatulence?,1
Is there a nutritional difference in fresh whole veggies vs pre-chopped and packaged veggies like carrot/celery sticks?,1
Does adding flavor to water decrease how much it hydrates you?,1
Do people doing alternate day fasting need to get any nutrients on fasting days?,1
Will I get sick if I drink raw eggs?,1
Does anyone have any advice for how I can eat in a way that my food is digested quicker ?,1
Uncooked or cooked calories,1
UK Product Information Database including ingredients??,1
Optimizing Refeed While Carb Cycling,1
[ASK] Does Fiber break down in vegetables when boiled too long or pureed?,1
Looking for SIMPLE COMPLETE MEALS,1
"Do cashews have cartenoids, beta carotene, or lutein? I see differing information online.",1
Is there a correlation between having circles under eyes and diet?,1
Can the body change one nutrient/amino acid into another?,1
A new product is launched in the UAE that’s adding vitamin D to water bottles. How effective is this really?,1
How bad is aspartame?,1
"Science Friday: News in Nutrition (February 23, 2018) For discussion on the latest news and research in nutrition science",1
How is bean pasta so protein-rich?,1
Anyone else hate how subject nutrition is?,1
"Article claims that Chromium Picolinate can cause depression, anxiety, and schizophrenia from prolonged use. How much truth if any is there to this and if it is true why do they put it in almost every multivitamin?",1
"Is it true that prolonged use of chromium picolinate can cause depression, anxiety, and schizophrenia?",1
What Is This Sub's Consensus On Omega-3 Fish Oil Pills?,1
Do different bones from the same animal make different quality bone broth?,1
Why do calories and macros not add up when eating out?,1
What do these ingredients tell you?,1
What is the primary energy source for the human body?,1
Nutrition Supplement,1
Scientific studies on Stevia?,1
Is sous vide the best way to cook meat if cooking at high temperatures creates carcinogenic byproducts?,1
How can I make sure I'm getting exactly what I need each day?,1
What do you guys think of the Eat to Live diet?,1
Why is this soy product so low in fat and carbs?,1
Is It 'Worth it' To Eat Healthy?,1
How much EPA or DHA to expect from 10g of flax seeds?,1
Sodium in a whole food diet,1
How long does it take for food to show a reaction? Specifically an acne outbreak?,1
"Ketosis vs. Whole Grains, Legumes, and Berries",1
How do you determine how much to eat when you don’t have nutrition facts?,1
"What are five things you would recommend someone to add to their general, balanced diet, assuming they currently took no vitamins, oils, supplements, whatever?",1
"Whey, BCAA, and EAA. When and why?",1
A healthy diet. With some conditions/guidelines.,1
"Anyone wish the diet evaluation thread was more active? I'd rather post my diet as a new thread where someone would actually see it, but it'd be against the rules. Anyway, here's my diet.",1
How does meat consumption affect strength/muscles?,1
What are all of the ingredients that would assist in fighting bone loss?,1
Will the calcium found in natural skimmed milk Yogurt (Fage 1%) benefit my teeth?,1
Question about the MIND Diet,1
Your thoughts on omega 7?,1
Orgain Protein Shakes— Pros/Cons,1
"Why do all multivitamins and electrolytes have such little calcium, magnesium, and potassium?",1
Is there meaningful nutrition value from drinking fruit juice?,1
"When trying to eliminate dairy, is it okay to have whey protein isolate?",1
What do you think of nutritionfacts.org?,1
"/r/Nutrition Diet Evaluation Requests (February 26, 2018) - For ALL individual circumstance questions and evals pretaining to what you eat or might eat",1
How accurate is cronometer?,1
What happens to your body when you eat the same foods consistently?,1
"High carb, low fiber foods",1
College diet problems...,1
Is my diet healthy?,1
I am looking to change my lifestyle and improve my eating habits for good. How many sessions with a dietitian would help me with this goal?,1
Healthiest foods that contain NO calcium?,1
Good resources on micros?,1
Is there much difference between vitamin brands?,1
How many cals and grams of protein are in a grilled chicken leg quarter? Getting conflicting results.,1
Does feeling mentally and physically better in a fasted state indicate a body's preference for a ketogenic diet?,1
How much nutrition will cooked food lose after you put it in the fridge (and how fast will it lose it)?,1
Oats,1
Is soy detrimental to strength athletes?,1
HELP!!!,1
Are there any scientifically proven short-term ways to loss fat (that don't involve starvation or surgery) ?,1
2 Carrots and 1 Bell Pepper,1
"Іf уоu dоn't еаt trаns fаts оftеn wіll thеу bе trаnsроrtеd аwау, оr аrе thеу stuсk whеrе thеу аrе еvеn іf уоu dоn't еаt thеm оftеn?",1
іs thеrе аnу quісk wау tо іmроrt multірlе fооds аt а tіmе іn сrоnоmеtеr оr must уоu еntеr іn аll thе dаtа уоursеlf mаnuаllу?,1
AMA with Stanford Professor of Nutrition on r/loseit,1
Is eating 100% whole wheat bread regularly healthy? Should people be eating MORE wheat?,1
Can you help me overcome food aversion?,1
Is ground turkey a better alternative to beef?,1
Protein Powder,1
What known diet/nutrition beliefs do you know that have been proven to be false?,1
Does biotin work?,1
Is limiting your food to the day to one apple or the equivalent of one apple tolerable health wise?,1
Would limiting your total food for the day to one apple or the equivalent of one apple lead to any drastic health issues.,1
Does the sugar in kombucha outweigh the benefit of the bacteria/probiotics?,1
Why does low fat Greek yogurt have more protein than normal Greek yogurt?,1
Chia seeds absorb 5x (or more) the its volume in water. What are the ramifications of this?,1
Increase in nutrition knowledge ruining eating habits,1
Nutrition Consultant for Health Food Business,1
I want to completely revamp my lifestyle/diet/etc. I want to live the healthiest I possibly can/do everything to keep myself healthy.,1
"How is it possible for a same food, to have such a difference in nutritional facts in a different brand?",1
[Question] To bean or not to bean: are beans an optimal source of slower carbohydrates?,1
Substituting my breakfast meal with a mass gainer.,1
Is eating 1lbs of extra lean beef a day unhealthy?,1
Red meats: Time for a paradigm shift in dietary advice,1
Where are the best places to learn about nutrition online?,1
"Are ""Free Antibiotics/Hormones"" Chicken worth the extra money?",1
"Gaining weight through ""healthy"" or ""unhealthy"" foods",1
"I understand that you can build a caffeine tolerance, but how much does that diminish its effect?",1
Mealviser,1
thoughts on Maltodextrin,1
whey protein - Vegetable juice?,1
Chick peas,1
Do cooked oats have 63 or 389 calories per 100g?,1
Are vegetables necessary?,1
Tryptophan to Serotonin conversion.,1
"Roughly speaking, how many grams of monounsaturated fats will negate the LDL gain from 1g of saturated fat?",1
"I know a good diet is a varied diet, but am I really missing out on much if I don't eat certain foods regularly?",1
"Is alcohol induced bulimia a thing? Every time I drink somewhat heavily, I feel like I need to make myself vomit at the end of the night?",1
61 grams of potassium in one bottle of Teavana Craft Iced Tea,1
different oil misinformation,1
"Severely anemic, pregnant, vegetarian partner",1
How to calculate calories and nutrients in cooked dishes?,1
Dry carbs sources,1
Can the cooking process significantly alter nutritional content,1
Formula for a Fad Diet - Nutribollox 101,1
Palm oil is carcinogenic?,1
Protein goal vs Macro targets,1
Which beans/legumes are the most nutritious? Charts would be appreciated,1
"Science Friday: News in Nutrition (March 02, 2018) For discussion on the latest news and research in nutrition science",1
"Amino acid profiles of rice, pea and pork proteins",1
modified corn starch - health benefits?,1
Celiac-Vegetarian-Low Oxalate Diet: looking for collaborators to generate recipes!,1
"Arsenic, Lead Found in Major Protein Brands - Quest, Isopure",1
What route to take to work for a food science company? (Non-RD),1
QUESTION: Are vitamins affected by Heat?,1
Beef jerky replacement,1
Are there any studies that relate RDA by individuals?,1
"Yes, bacon really is killing us. Decades’ worth of research proves that chemicals used to make bacon do cause cancer. So how did the meat industry convince us it was safe?",1
Are there any reputable sources that give the glycemic index of foods the way people actually eat them; i.e. hummus with white bread and olive oil?,1
What's the difference between potassium bicarbonate and potassium?,1
Beta Carotene (Carotenoids) to Vitamin A liver stores,1
Conflicting information about fiber,1
"Allergies gone, don't remember last time I was sick, feeling satiated and not full... all thanks to reading nutrition labels and tracking macros. That being said, how do you deal with people who try to make you feel like crap for watching what you eat? (srs)",1
Is skimmed milk able to replace hypercaloric supplementation?,1
What is the actual added value of a side mixed green salad?,1
Does a high carb intake contribute to NAFLD (Non-Alcoholic Fatty Liver Disease) or just high fructose intake?,1
"Do substitute milk Almond,Soya etc contain much of the nominated plant with all benefits of it or just traces if any ?",1
How do you stick to your diet and not be anti-social?,1
Carbload - do all carbs bind the same amount of water?,1
Dоеs fооd іn іrеlаnd usе аrtіfісіаl trаns fаts?,1
"On a purely nutritional basis, ethics aside, is there any reason not to eat good quality, low fat meat?",1
"/r/Nutrition Diet Evaluation Requests (March 05, 2018) - For ALL individual circumstance questions and evals pretaining to what you eat or might eat",1
"What simple, cheap foods can I eat daily to get all my nutrients, alao so I'm not doubling up on the same nutrients in different forms all the time?",1
"What cheap, simple, household staple foods can people eat daily to cover all nutritional needs?",1
I find it impossible to get 25 grams of fiber a day,1
How unhealthy are Smucker uncrustables sandwiches?,1
Meat never makes me full. Anyone is the same?,1
Love to powerlifting but I’m broke for food and go to college,1
hоw mаnу grееn bаnаnаs реr dау shоuld і еаt tо орtіmіzе mу gut mісrоbе рrеbіоtісs?,1
Healthy salad dressings?,1
Do aged or cured meats and dehydrated veggies have less nutrition?,1
Love vegetables on Pizza or in Rolls but hate eating them by themselves?,1
How many calories are eliminated when you remove skin from chicken leg quarters?,1
Why do carbs make you hungry?,1
Today I realized and should have been obvious but roasting nuts probably isn't good for the fatty acids. Your thought?,1
Will I still get the benefit of these herbs if.....,1
Is it possible to put on mass and size while on a low lectin diet?,1
Why do thin people seem to prefer different foods than overweight people?,1
Pomegranate juice heart health,1
Has anyone noticed trouble sleeping after eating more coconut oil or cruciferous veggies ?,1
Why do we need greens?,1
Do broccoli microgreens contain the same amount of glucoraphanin (precursor to sulforaphane) as broccoli sprouts?,1
dоеs mаgnеsіum suррlеmеnt bеnеfіt slеер еvеn іf уоur аlrеаdу gеttіng RDА frоm fооd?,1
"According to this Harvard study, whole wheat bread is very similar to refined bread in terms of the glycemic index. If this is true then why is whole wheat the better option?",1
Would this be a good idea to make a website with healthy realistics meals or does it already exists ?,1
Is soda an acceptable form of carbs?,1
Understanding Cholesterol,1
Gut health essentials?,1
Major cause of dementia discovered. The build-up of urea in the brain to toxic levels can cause brain damage – and eventually dementia.,1
Is this list accurate? Sources of each Vitamine and mineral we need.,1
"I'm eating only one meal a day, and I need to max my protein intake. Suggestions?",1
Help me out with this simple question.,1
What's the deal with sodium?,1
So much information...,1
"Identify this ""diet""",1
"""...carbohydrates are the first source of energy for our body, without it, protein from our muscles will be used meaning that our body will effectively eat its own muscles!"" Is it true?",1
"If you consume vegetable oil, does your body instantly become inflamed as the oil travels through your body?",1
Does optimal nutrition strongly affect cancer probabilities?,1
What are the calories in nuts and those that are actually absorbed,1
Eating only 2 and a half days out of the week,1
Fasting for 4 days out of the week,1
Silly question about fibre,1
Nutrition/Simple Cooking Book Recommendations?,1
Doritos Sweet Chilli - Is it Healthy?,1
Low fiber vegetables ideas?,1
"uрsеt stоmасh (mауbе blоаtеd?), соnstіраtіоn &amp; fееls lіkе І nееd tо fаrt, but саn't: whаt іn mу dіеt соuld bе саusіng thіs?",1
Got real bad gas. Think it’s the oats. Need help!,1
How much protein do I need per day? examine.com,1
How much protein do I need per day? examine,1
All the Government and Private hospitals in the state of West Bengal in India will have their OPD's shut down for tomorrow to protest against the merciless beating of Intern Doctors over the death of a patient.,0
Question: pancuronium bromide vs. rocuronium bromide?,0
"Indian doctor beaten up by goons because a critically ill 75 year old patient died. In his early twenties, his career may be over before it has even begun.",0
Is it safe to smoke weed after surgery?,0
"Do you spend time volunteering, or do you instead feel you have done enough “good” at work that this is unnecessary? If you do volunteer, do you do medical or non-medical volunteering?",0
Medical books that are a joy to read,0
EMA restricts the use of fluoroquinolones in LUTI prevention and other procedures/conditions,0
"""Oh, by the way..."" ""While I've got you in here..."" ""Wait, I'm not done yet...""",0
"How do you personally maintain your compassion and reserve judgement when treating ""difficult"" patients?",0
Any good nerve agents?,0
"PCPs, how often do you see your patients?",0
A Question for D.O. Physicians...,0
New development in WB doctor strike: Chief minister of WB blames interns for causing drama and threatens interns with government action who doesn't join work in 4 hours. Said nothing about security.,0
"Weekly Careers Thread: June 13, 2019",0
Any MDs working in pharamcueticals? How do you set your salary?,0
Turmeric for anxiety and long term use,0
SIDS Data,0
"Doctors who got out of medicine, let’s discuss it. How did you do it? Did you regret it? A lot of us want to. As promised, the “hardcore let’s get out of medicine thread”",0
How do you beat burn out?,0
How do you cope with burn out?,0
Is being a doctor that bad?,0
[Writeup] Hong Kong doctor-lawmaker Pierre Chan in doubt of Hospital Authority's statement over patient privacy,0
"Medicine Students, Doctors, or anyone with knowledge in Medicine applications for University, I need your help!",0
Question from a medical student: How hard is surgery?,0
"Canadian finishing Residency in USA, What to do next?",0
Life and work routine as an Internal Medicine Hospitalist in USA?,0
What's left I can take?,0
Why does heating up food not increase the calorie count?,0
At What Dollar Amount Should I Be Concerned About A Doctor Receiving Money From Pharmaceutical Companies?,0
At What Dollar Amount It Be A Concern That A Doctor (Psychiatrist) Is Receiving Money From Pharmaceutical Companies?,0
Anybody have experience with out of cycle ACGME approved fellowships?,0
Would you recommend doing foundation training in London? (UK Medics),0
Why does body movement (restlessness) relieve visceral pain?,0
Rural Africa: Removing Uvulas to Cure Diarrhea,0
Dealing with medical mistakes?,0
Supplemental income in medicine,0
[serious] does anyone who works in the hospital wear oofos shoes? How good are they for standing in the OR for hours at a time and then walking around the hospital on rounds?,0
Panama UTI Medicine,0
Nursing union wants medicare for all and its insidious,0
100 Babies Dead - NGO Wants U.S. Missionary Prosecuted in Virginia,0
Software engineers making more money than doctors?,0
Research is being done into stool transplants for patients with severe intestinal infections.,0
Symptoms worse,0
Has anyone tested Biospect or other Quantum Magnetic Resonance Analyzer?,0
Question: EMR overdocumentation or underdocumentation- legal implications,0
How late is late pill?,0
Is anyone here using a service to text their patients?,0
Post Tonsillectomy Question,0
"In your opinion, what are some concepts/skills that every new intern should know about?",0
Carreer Advice,0
Could any medical practitioner or medical student tell their experiences with having a non-medical partner?,0
Quick question about a cerebral vascular abnormality condition,0
What's the funniest thing that's ever happened to you at work?,0
The Indian Doctor Happening: A non-Doctor's view,0
The physician who made it a standard to make young boys turn their head and cough while he/she felt up their nuts was a pedophile,0
"Is it true that ""The return on investment for pharma R&amp;D is rapidly shrinking – drug discovery is too expensive to consistently make money anymore.""?",0
Stomach Pain,0
Are oofoos shoes good for surgery?,0
I can't choose what to do,0
What is life like after quitting med school?,0
"Recommendation for best secure, shareable, HIPAA compliant task manager?",0
Do any of you routinely prescribe metformin to prediabetic patients to prevent progression to type 2 DM? What caveats do you have?,0
German doctor looking to practice elsewhere...,0
Medical related blogs: HIPAA issues,0
Pap smear flow?,0
Eric Cropp (pharmacist) and Radonda Vaught (nurse),0
Atul Gawande's Senate Recommendations On Aging,0
Women who perform pap smears - do you always bring a chaperone?,0
A national advance care directory?,0
I have a problem with farting,0
"I ask you to tell me one story or one quote about medicine that resonates with your experience or your view of practice, positive or negative. What do you reply?",0
Support person question.,0
"[Writeup] Hong Kong private hospital refuses to ""treat any injured people involved in criminal activities,"" sparking controversy",0
"[Writeup] Hong Kong private hospital ""will not treat any people who are injured due to criminal activities"", sparking controversy",0
Honest opinion on Locum companies,0
General Surgery Podcasts,0
Recommendations for an employment lawyer? A resident is getting kicked out due to pregnancy issues.,0
Mono,0
Itchy Butt Crack,0
Residency underperformance and fellowship aspirations,0
What are your favorite ICD10 codes?,0
Chronic lower body pain.,0
E/M codes,0
Seeking psychiatry care - cash vs insurance?,0
"If my Primary Care doctor only has a PA and not an MD degree, does that make her less qualified?",0
How many precautions are appropriate for a punch biopsy?,0
Clinical presentation of cardiac cirrhosis,0
"I was just prescribed propecia for hairloss and I smoke marijauana, are there any interactions I should worry about?",0
What do you think the diagnosis is,0
What's the weirdest/most inappropriate referral you've ever had?,0
A question about femur pressure,0
"Symptoma.com - is it a reputable learning tool, especially as a med student or resident?",0
"Would you respond and take action if there was a medical emergency on your flight/train/etc or just sit quietly, hope not to be noticed, and continue your travel?",0
"Would you respond and take action if there was a medical emergency on your flight/train/etc or just sit quietly, hope not to be noticed, and continue your travel?",0
Physical Exam: Approach to Oral Exam,0
"I am writing a guide on how to prevent RSI as a musician, would any medical professionals out there like to take part in a short email-based interview in the near future?",0
AHA BLS Online portion SUUUCKS,0
How do surgeons know where to put all the small intestine folds back in the right way after examining it?,0
Is there a reason this subreddit isn't private?,0
Triple Degree in Nursing/Medicine/Law,0
How do I learn (post-graduate) pharmacology?,0
Atenolol 50mg,0
"AMA: We are the Asclepius Snakebite Foundation (ASF), a team of snakebite experts working to address the global snakebite crisis and provide you with the right information to manage these patients. Ask us anything!",0
"Congratulations, new doctors and new graduates!",0
[Question] IM Testosterone given SubQ. Are there dangers involved?,0
What are the differences between a physician assistant and a nurse practitioner?,0
Ethics concerning a diagnosis,0
How to avoid knee replacement surgery?,0
Leptin and insulin connection,0
Resources / information on marketing/advertising a medical practice / service.,0
The Doctor Who Went to Chernobyl. What would you like to ask Dr. Robert Gale?,0
"Canada (Vancouver, B.C) Job Shadow/Career Observation/Supervised Practice Experience Advice Needed",0
How long does Akathisia last for?,0
Career in Medical Devices,0
Can any vitamin or supplement help me with my fatigue?,0
Do you pray for your patients?,0
"Still no hospital contract, moving this week for a job, how screwed are we?",0
Self Contained Portable Operating Rooms.,0
Self Contained Portable Operating Rooms,0
PBS documentary,0
How does blood alcohol levels translate to legally defined levels?,0
I'm curious..,0
A Sports Medicine Physician went to Wrestlemania one year to study the rate of concussions among the performers.,0
let’s assemble some advice for the new (medicine) interns starting next week: what’s one thing every intern should know?,0
I’ve been hearing a lot of conflicting things about the DNA heritage tests. Are they really accurate with the percentages? I’m wondering from a medical perspective,0
Teach yourself physician contract basics,0
"Procedural specialities (Surgery, Interventional Radiology): How is rising obesity epidemic affecting the routine procedures like central lines, thoracentesis that requires surface anatomy to guide you?",0
Spironolactone in ESRD patients on hemodyalysis,0
"""Who's going to take care of these people?"" Another hospital in rural America shuts down",0
"Peds people, what's up with giving babies H2 blockers? Is this really a thing?",0
When's doctors week?,0
[Weekly thread] Patients say the darndest things,0
Clonidine ER duration?,0
Switching to medicine?,0
What does it take to open a free clinic as a doctor in the US?,0
Are doctors are more protected than other professions from AI--by public perception and law?,0
Forgetting where you came from,0
Substance abuse (*),0
Clinical boundaries re: death of a patient?,0
Iron in the blood,0
Interesting Ethical Dilemma the Other Day,0
10 Secretes Muskmelon Benefits,0
Office Managers: $50 Amazon Card for 30 minutes of your time :),0
Looking for help with work OVD,0
"This has to be BS, right, Cancer causes ratio",0
"What're everyones thoughts on diuretics for ""edema"" with no history of heart failure?",0
College project: Healthcare HR service survey,0
'First' academic job -- what non-monetary items did you negotiate for?,0
CME that broadcasts to hotel room?,0
Alabama seems to be okay with executing large amounts of prisoners by lethal injection but doesn’t believe women should have the right to decide how to manage their pregnancy.,0
Encroachment in Primary Care,0
Did you ever have doubts about this profession? Why do you still do it?,0
Emotional Support Animals,0
The ACGME has failed us. Disband it. Let the Government regulate GME.,0
EM/FM Dual Residency Program?,0
"Weekly Careers Thread: May 16, 2019",0
Question.,0
Heart while spinning,0
Arterial Line Interstitial,0
Management of acute pancreatitis with acute CHF exacerbation?,0
Opinion on a case please.,0
3D stereoscopic interactive displays/Feedback using 3D tools and software to learn,0
Specialty training positions (Australia),0
