title,nutrition
Lipid Panel results &amp; have not heard back from Dr. Are these good? Will running help?,1
Why's there so much BS on fat and nutrition in general?,1
What cleanse/detox would you recommend for a newbie?,1
"Best WOE for Healthy, Sustained Weightloss",1
Advice on Ratio re: Improvised Multivitamin,1
How does one get a career in nutritional sciences? Help!,1
Shit dinner a+ breakfast and lunch and a multi,1
I’m considering hopping on the Macro bandwagon. What are some good websites/blogs/etc to get me started in the right direction?,1
Is a no carb high fat diet healthy?,1
Heating Extra Virgine Oils,1
Looking for a book that will teach my teenage daughter how and why to eat healthy,1
Easy replacements for breakfast cereal?,1
Dry food for hiking,1
Healthiest way to gain fat and lose muscle mass?,1
"Science Friday: News in Nutrition (July 27, 2018) For discussion on the latest news and research in nutrition science",1
Does Outback Steakhouse Uses MSG?,1
Healthiest food to eat in excess in order to gain fat and lose muscle?,1
Are premade meals healthy?,1
How can I make a Multi-Vitamin Stack WITHOUT VITAMIN A?,1
Young and hopeless tbh,1
What are some Multivitamin alternatives for Accutane Users?,1
Why is it recommended for humans to eat a diet with variety when many other animals eat the same exact food for their whole lives?,1
I don't like skin on chicken. Am I missing out on any nutrients by not eating it?,1
"Working 3rd Shift, New Born, and Dieting Question.",1
“Fruit and vegetables only for a month” questions ...,1
Cola vs Alcohol free beer,1
Question: how many microns are there in a fluoride?,1
20 item grocery list.,1
Microwave &amp; Antinutrient Content,1
do i count calories based on the weight with or without the inedible parts?,1
Calcium Supplement vs Almond Milk,1
Macros/calories for vodka?,1
I’m under the impression that I need to eat much better,1
How to find and evaluate a dietician?,1
How long to stay in the sun for vitamin d,1
Am I better off trying to eat enough calories or eating food that is healthy?,1
Are there any benefits to bone broth?,1
Are the Nutritional Value Tables on Wikipedia accurate?,1
Is sugar in certain milks bad?,1
"A few questions if anyone can help? (No gluten, low sugar, PCOS)",1
Why aren't our states doing anything about the health crisis that is todays ''food''/nutrition?,1
Full Time Diet Plan Help,1
Rainbow Light Vibrance - Why does it cost 2x the Regular?,1
Am I getting too much Iron?,1
'The Eatwell Guide' from the UK's National Health Service,1
anhedonia after exercise,1
"Is there a way to calculate an objective ""Nutritional Value"" using the amounts of protein, lipids, carbohydrates, water, and kilocalories in something?",1
How do veggies fried in sesame oil as a stir fry compare in nutrition to other forms?,1
[Discussion] Breaking up Biofilm,1
Has anyone done a write up on the best/cheapest way to hit all of your micronutrient needs on a budget?,1
exercise,1
What is considered healthy food list for potential heart attack victims?,1
Too much sodium,1
Are pre-workouts safe for a 16 year old?,1
How many calories to gain muscle?,1
How does light affect different types of foods stored in clear glass jars? [x-post from /r/askscience],1
Is eating the shells of sunflower seeds and peanuts good for you or potentially harmful?,1
Kirkland ground beef patty.. trans fat,1
Question concerning omega fatty acid ratios,1
No sugar diet options?,1
Nutrition for a 15 y/o kid?,1
Can you gain healthy weight without working out?,1
I Can Get A McDonald's Sandwich For $1 Everday Until October - Am I Going To Die?,1
is 100% natural peanut butter bad for you?,1
(Question) Are there any foods found in nature that are both fat+sweet?,1
Chipotle?,1
Does eating high amounts of sugar in a short amount of time Lead to your body activating fat accumulation and production of triglycerides,1
What is best health plan for living healthy?,1
Which peoples advice do you generally follow or value highly?,1
"/r/Nutrition Diet Evaluation Requests (July 30, 2018) - All personal circumstance questions and evals pretaining to what you eat or might eat must use this post",1
"Niacin: does it reduce non-esterified (free) fatty acids, or instead reduces serum triglycerides (esterified fatty acids, carried by lipoproteins and chylomicrons)?",1
I get so sad when I think about Fiber One cereal,1
How does a zero calorie drink have some carbs?,1
Effectively utilizing Pre/Post workout meals,1
Is Gary taubes a case against sugar a good informative read?,1
Prioritize Cutting Calories vs Protein Intake?,1
What is a fairly healthy drink I can have in the morning? At the moment i'm sticking with a glass of coconut water.,1
"Low-fat, calorie dense foods?",1
Wild Game meat,1
What is the big deal with Gfuel? Would it be okay before a workout?,1
"Really, Oxalate and Frequent Urination: What's the Connection?",1
Keto diet with manual labor job,1
How has your life changed since getting all your vitamins daily?,1
Infant diet,1
Drinking tea through intermittent fast,1
Piggy back lipid in TPN?,1
Is it ok for me to take multivitamin?,1
Certified Health Coaching,1
Why am I always craving sweets?,1
Interesting new healthy snack item...,1
"If I'm packing all the food I need for a day into a container and taking it with me, what should be in it?",1
Extremely confused reading these 2 nutrition facts labels...,1
Will eating more anti-inflammation food improve my brain?,1
Pre vacation maintenance?,1
Protein,1
How important is dairy?,1
Dietary fat intake frequency,1
"Combining acid forming and alkaline forming foods, to make a meal alkaline?",1
Can a cup of tea with milk count as breakfast?,1
Drinking tea through fast (modified),1
"I stopped eating dairy in january, is there any nutrients im missing out on? Are there any supplements i should be taking?",1
How can we have a good body?,1
Late night snacking?,1
Soybean Oil Is More Obesogenic and Diabetogenic than Coconut Oil and Fructose in Mouse: Potential Role for the Liver,1
The ketogenic diet,1
What diet do YOU follow?,1
Does taking a vitamin D pill keep you awake if you take it in the evening?,1
"when are these 'science based green detox"" ads gonna stop?",1
Buy Bioglan Spirulina Powder Online,1
Beginners Guide to Eating on the Healthier Side?,1
Question about keto,1
"I've heard that the more distant the animal is on the evolutionary tree, the healthier the meat is for you. Is this true?",1
Started eating more food to gain weight. Now my stomach is all upset. What do I do?,1
Need general advice for pooping regularly / nonpainfully (Fiberone),1
Is Dr Eric Berg legit?,1
from plantbased diet back to eating fish due to paranoid issues,1
"Are ""antinutrients"" something one should be worried about?",1
I'm devouring fruit! Can't get enough! What gives?,1
What's the difference between vitamins in food and vitamins in supplements?,1
Help with water retention/puffy face,1
Water retention - alcohol sometimes helps?,1
Preworkout meal if still full from lunch?,1
Low fat has added sugar and low fat is linked to obesity,1
The Rabbit Hole,1
"I'm so used to fast food, I forgot what regular people eat.",1
Can someone tell me about epigrow and laxobolic? Any side effects good or bad I should know about?,1
Question,1
Healthy supplements to fill face,1
Ostevit D Tablets,1
"How quickly can you absorb water? At what point are you drinking ""too much"" in a short amount of time?",1
Protein Absorption from Liquid Source - How Much?,1
Any benefit to spiking insulin post workout?,1
Overdosing on niacin?,1
Are Mia Flavored drinks considered high in Potassium?,1
Biotin Supplememts,1
"How detrimental is a ""high"" sodium intake? + a couple of other questions",1
Help me choose a professional for optimal health,1
Some advice on choosing a professional for optimal health,1
Diets should be personalized,1
Plant based protein help,1
Help creating a list of foods my grandparents can supplement with to lower sugar intake?,1
What’s the best/fastest way to recover from dehydration?,1
a very interesting article about low carb professional ironman competition - this guy won last weekend in Zurich,1
[nutrition] Hydration after CrossFit,1
Why does some beef broth contain wheat and soy whereas chicken broth doesn't??,1
Taking a multivitamin when I didn’t eat a full meal that day,1
"If the increase in blood glucose caused by eating pasta is reduced by 50% if the cooked pasta is frozen then re-heated, will this effect increase if the process is repeated?",1
What would you suggest?,1
Help.,1
Pros and Cons of Fizzy Vitamin tablets?,1
Vegetables - Know these healthy foods | Smart Healthy Foods,1
"When you start to exercise, you need to start slow. Does the same principle apply to nutrition?",1
How do you Account for Cooking Oils?,1
"Nutrition &amp; Dietetics | Dietician in Malleshwaram, Bangalore | ManipalHospitals",1
Supplements that give a muscle pump on low carb diet?,1
What' the Macronutrient-ratio at which calories are burned at different intensities and workout lengths?,1
"Nutritionists and dieticians of reddit, what was your first nutrition related job and what did it entail?",1
Organic chicken beast,1
Can fruit be an adequate main source of carbs / calories?,1
Do you still wash bagged greens?,1
Is there a causation between eating poorly before bed and being fatigued/sleeping in?,1
A simple question about (natural) sugar,1
Nutrition source that is unbiased or doesn't have an agenda?,1
Does the nutrition facts at restaurants include cooking oil and butter?,1
"Meat, veg and fruit?",1
Hungry on 2k calories,1
Should we pre-soak buckwheat overnight?,1
"Are there science-based, books/guides out there about the preparation and nutritional value of whole grains?",1
Are artificial sweeteners unhealthy?,1
Getting back into the gym after 5 years and have high cholesterol,1
Calcium,1
Best fast carbs/sugars?,1
Does anyone here have any decent mnemonics for dietary minerals and trace minerals?,1
Please recommend some good books on nutrition.,1
Are ground spices and dried herbs cooked?,1
Does a bigger appetite correlate with a faster metabolism,1
What Are Some Things That You Would Like To Know About Your Dog's Nutrition And Dog Food?,1
[?] Terms for the biologic benefits of eating certain foods together or in sequence,1
Digestion enzyme supplements - scam or helpful?,1
Is turkey spaghetti healthy?,1
Can one eat a lot of nuts (almonds) and still achieve a 6pack?,1
At a loss on nutrition,1
What are some good diets to help build muscle?,1
Gender difference in nutrient needs,1
What are common foods that contain branched chain amino acids (apparently some chronic diseases are worsened by branched chain amino acids)?,1
Strong guy that doesn’t want to lose muscle,1
"/r/Nutrition Diet Evaluation Requests (June 18, 2018) - For ALL individual circumstance questions and evals pretaining to what you eat or might eat",1
Prediabetes and exercise,1
Advice Needed: Does pink beef have less fat than well done beef?,1
I’m having trouble dieting because of my pickiness.,1
How much grams of canned tuna can you eat per day?,1
How do I prevent massive instant hunger?,1
Are Whole Grains toxic to humans?,1
"Want to eat yogurt, but lactose intolerant",1
What is perfect to drink or eat when it’s 90 degree weather?,1
Healthy/Affordable/Easy Meals for a Runner?,1
I forgot to grab my packed lunch on the way out this morning on the way to school.,1
Banana Chips,1
What do you think about Kombucha?,1
Does this look like a good greens powder to cover any deficiencies? (Naturelo),1
What is a normal sized breakfast?,1
Vegan friend has gone too far,1
The Collapse of a $40 Million Nutrition Science Crusade,1
Too many supplements?,1
"The science and politics of nutrition conference - Panel discussion on ""What evidence can we trust?""",1
Does intermittent fasting effect muscle growth if workouts are completed during a fast?,1
Teenage boy calorie consumption,1
"If fast-food outlets froze then thawed their burger buns before use, would everyone's health benefit?",1
Excessive protein,1
Whats the deal with Raisins?,1
Review my Meal Plan,1
What is a good replacement for energy drinks?,1
Local Pastrami: Labeled 18% Protein,1
Tips for Avoiding Sugary Snacks at Work?,1
Review my Meal Plan,1
White Stevia powder vs Green Stevia powder - which is better? Why?,1
"Those who like it sweet, what do you prefer? Why? Sugar, brown sugar, demerara. coconut sugar, raw honey, agave, stevia, sucralose,.. ?",1
Why are restaurants and other non-retail food companies allowed to not disclose their ingredients at all?,1
Here's how you can get the nutritional value of drained tuna in oil. Or any can in oil.,1
Tips to Avoid Sugary Snacks?,1
Calorie Law in USA,1
Am I eating too few calories?,1
Room temperature water is better for you than cold?,1
Are those bags of frozen avocado at walmart of good value? Or should I stick with fresh Avocados?,1
"Good online, non-governmental overview of nutrition science in 2018?",1
Sport drinks,1
Carbohydrate question,1
"Presentation: Dietary patterns and whole foods (Matthias Schulze, 2018, 20:36)",1
Butter made with olive oil.,1
"From someone who tried it, how good is psyllium?",1
"How to make salad tolerable? I'm a picky eater, can't find any dressings that I like",1
So I'm starting a fitness plan and I need to count my protein. I dont understand how FROZEN food works with protein? Is it the same as fresh?,1
Refine carbs vs unrefined carbs,1
What's wrong with my muesli? It's making me nauseous,1
Is this legit? Cutting the calories of rice in half by boiling them with coconut oil and cooling them for 12 hours.,1
"Question: If a doc says to keep sugars under 36g a day, does that mean even fruit? Looks like one freakin' honeycrisp apple has 25g! Assuming that's the case, just learning to adapt - thanks for any helpful answers, since I love fruit (and sugar in general).",1
Air drying clothes - Natural laundry detergent but fluoride water.,1
"I love crab legs, but why are they held in such high esteem?",1
Is eating mostly rice for most my carbs bad due to low variety?,1
Do you expose yourself to hypoglycemia when on a diet?,1
Why are Advanced Glycation End Products (AGEs) rarely talked about and seemingly a low priority in terms of health/nutritional awareness?,1
Why do we think of calories in vs calories out on a daily level?,1
"""Raise insulin – gain weight. No insulin – lose weight"", so what happens to all the calories in the food we eat?",1
"TDEE calculators say I should eat ~200g of protein or more a day, how?!",1
Carbs v Refined Carbs,1
"Experts suggest we eat no more than 38g of ""added"" sugars per 2000 calorie diet and eat roughly 250g of carbs per 2000 calories, but since sugars are a carb, can we eat over 200g of healthy sugars a day?",1
[delete if not allowed] ED Nutrition Help,1
"Is someone absolutely hates vegetables, could they theoretically just eat some Chlorella and Seaweed to get all the nutrients they are missing?",1
Is it okay to chug/fast drink a nutribullet mix or is it more beneficial to slowly drink it?,1
Good sources of fibre with minimal iron?,1
Insoluble fiber calories,1
"Counting calories question, does the method foods are cooked influence nutritional value?",1
Eating pattern really bad,1
How much meat do I need to consume in order to get the nutrients I'd need to supplement otherwise?,1
Is there a Percent Daily Value for all sugars?,1
Chicken Breast Nutrition,1
How quickly can I expect to see results from intermittent fasting (16/8),1
Is it bad to eat right before you take a nap?,1
"Hair thinning out, diet/vitamin recommendations?",1
Is it healthier to consume and burn 2000 calories or consume and burn 2500?,1
Hunger and multi vitamins,1
"Taking lunch to college, have classes all day",1
What is the best diet or meal plan?,1
cheap way to lower potassium,1
"Eating a LOT of low calorie foods, vs eating a low amount of high calorie foods",1
Is Chlorella factually the most nutritious food in the world?,1
Why does high calorie food make me sleepy?,1
Would you say that invert glucose syrup is most likely to be made out of corn?,1
Optimal Fasting timing to eat the MOST in one sitting?,1
How important is it to have proper Omega 6 to Omega 3 ratio if all you eat is healthy?,1
Eat Your Greens?,1
Opinions 100g refined sugar with 1 litre of water? (before run),1
Sardines canned in sunflower oil,1
Would it be unhealthy if I drink 100gr of liquid butter daily?,1
Is a whole grain focused diet a bad thing?,1
"I really don't think I can hit my potassium goal without supplements, is that a bad thing?",1
Can someone talk to me about fish oil/omega-3?,1
Low carb diet seems to be causing low blood sugar and or insulin resistance.,1
I don't think this salt substitution chart is correct...,1
Zevia zero calorie soda.. how much is too much?,1
All about the bloat...,1
I've been taking a multi vitimin before bed thinking that I should give my body some ammo to repair whatever it repairs at night. This is based on nothing except that it makes sense in my head. Is there anything to this? Is there a best time of the day to take a vitamin?,1
Health complications of being underweight,1
Vitamins lead to longer naps?,1
"The 4-hour body book - Supplements. Garlic, ALA etc. Has anyone tried it?",1
Refined olive oil VS refined sunflower oil for frying,1
Opinions on mustard seed oil?,1
Nutrition Program Institute,1
Magnesium Content in cacao powder,1
How to do a sugar detox,1
Ceviche safe?,1
"Science Friday: News in Nutrition (June 22, 2018) For discussion on the latest news and research in nutrition science",1
Does a person truly need 5000 my of potassium per day?,1
"Question about calorie restriction, health and bodybuilding.",1
What vegetables are safe to eat raw vs cooked?,1
Does sugar really do this?,1
"All trans fats are ""banned"" as of 6/18/2018. What are the loopholes?",1
"I've heard that you can have a really shitty diet with lots of sugar, saturated fat, excess carbs, etc. as long as you exercise accordingly (the more extreme the diet, the more extreme the exercise). Is this true?",1
Do you think that I need to eat in a calorie deficit?,1
What are the signs your metabolism is getting faster?,1
Low energy switching from pescatarian to vegan diet,1
Where to Buy a Nutrition Diary?,1
Trying to find a non-synthetic Magnesium Oxide for anxiety/panic relief,1
Skinned legumes/beans vs whole: Difference in nutrition,1
Is OMAD considered healthy?,1
What are the risks of a ketogenic diet?,1
"Ice cream or other sugary desserts at night time give me seriously bad stomach pains/cramping the next day, for like half the day or longer.",1
White rice + potatoes are simple carbs??,1
Approaching Non-Digestible Foods,1
What is difference between baking cocoa and normal cocoa?,1
Can you absorb vitamins and minerals from raw mushrooms?,1
What product do you add to your bottle of water that tastes good and makes you feel healthier?,1
Confused on What This Exercise Quirk Means Nutritionally / Physiologically,1
"Attempting to purchase a B12 supplement, but really confused by the dosage values.",1
Junk Food and Nutrient Absorption,1
What breakfast sandwich do you recommend?,1
soylent.,1
Why is low carb high fat high protein diet used for ketogenic diet?,1
"How do Pizza (Papa John's), Frozen Pizza, Hamburger (Homemade), Hamburger (McDonalds) rank in terms of healthiness?",1
Vegetarian on no fibre low fat diet....help,1
How long can a lamb roast be frozen for?,1
Has anyone ever optimized a meal plan to include as many nutrients as possible?,1
Why does melted butter taste good with lobster and crab legs but not with steak?,1
"Should the following be taken on an empty or full stomach? ALCAR, Na-R-ALA, CoQ10, PQQ",1
A question about glycogen stores and refined sugar.,1
Any tips for liking or tolerating foods that you dislike?,1
сhосоlаtе ісе сrеаm: whаt tорріngs gо wеll wіth іt?,1
What is it about organic fruits/vegetables that causes them to be higher in antioxidants and phytochemicals?,1
Athletic vegetarians are full of s**t - literally,1
"Tasty, low calorie, fortified cereal with a decent amount of protein that has a complete amino acid profile?",1
(vegan) keto for endurance rides?,1
"Slow Carb vs Vegan ""daily dozen"" app diet?",1
I’m 15 and have never eaten a single vegetable all my life,1
How much since does sequential eating make?,1
Dr Michael Gerber and Vegetarianism vs Dr Rhonda Patrick and Ketosis -- who is right?,1
Help. A Healthy Diet Without Vegetables?,1
horrible diet! someone help me change my ways,1
Help me with vitamins,1
Oat bran vs rolled oats,1
Dairy. Where does it stand?,1
Interesting article on how tea can aid weight loss.,1
"/r/Nutrition Diet Evaluation Requests (June 25, 2018) - For ALL individual circumstance questions and evals pretaining to what you eat or might eat",1
"Raw, cold pressed Manuka honey...",1
"How much/little does it matter I hit the exact macros each day? If my desired TDEE is at 2200 and protein intake around 130g, and I’m not trying to be a bodybuilder, is it still okay to hit like 2000 calories and 110 protein one day, maybe 2425 calories and 142 protein the next day?",1
Question about calories in a Keurig coffee,1
Milk every morning?,1
"What is the nutritional profile of gelatin that's used to make capsules (e.g., fish oil)?",1
I need some help.,1
Nutrition: Avoid lifestyle-related diseases,1
can diet / calcium intake affect how clean your teeth are or how healthy?,1
"Removed from r/fitness, maybe you guys can help. I am curious about specific foods, activities and nutrients that boost energy and metabolism. Any suggestions?",1
Experience Taking DIM,1
Cronometer app anyone?,1
Metastatic cancer gorges on fructose in the liver. Researchers believe targeting this pathway could abrogate metastatic growth. • r/Futurology (So apparently a big reason the 1st world has a big cancer problem is because we frequently consume food &amp; drink high in fructose.),1
Stupid question? Mike Forman Grill.,1
Multi-vitamin or independent vitamins?,1
Best place to get workout supps?,1
"21 M looking to gain weight, but also eat healthier. How can I improve?",1
"What's more important to muscle growth? Caloric surplus, or protein consumption?",1
Is it worth entering ketosis,1
"Is there a such thing as negative calories, or carbs that digest quicker?",1
Is this a nutritionally good eating plan?,1
LIV RAW (Box of 15 Sachets),1
Creatinine levels,1
Any expert in nutrition wanna help ?,1
How bad are fast food without fries and only water?,1
Eating 8 eggs a week?,1
How do I know if I am not eating enough?,1
Question about chia seeds- are the nutrients inside actually digested and absorbed?,1
Benefit to MCT oil if not doing Keto?,1
Vegetable juice from concentrated...,1
DASH eating plan question,1
Viable substitution for canned tuna?,1
Post Show Water Retention,1
Could use some advice -- Gut Health and Skin Relation,1
"Post Show Water Retention, Halp.",1
is it possible to be both underweight and healthy?,1
Does making a smoothie or shake in a blender increase the glycemic load of the ingredients?,1
Canola Oil vs. Olive Oil,1
Calorie counting difficulties,1
How do empty calories work,1
Thoughts/Discussion on Nootropics: What's your experience? Do they work? Are they safe?,1
Is whey gold standard safe?,1
Help I’m so confused.,1
Explain fat and carbs to me please (t1d),1
"In terms of optimum health and avoiding AGEs, is it better to avoid consuming carbohydrates with fats and/or proteins together?",1
Low Glycemic flour,1
Looking for help reading US nutrition labels for fat percents.,1
Looking for a nutritionist for consultation,1
Question about Tea,1
is eating fried food cooked without oil as bad as cooked with oil?,1
Whey protein.,1
Increased Suicides in America--&gt;Nutritional Causes?,1
question about white blood cells,1
"Liquid in yogurt, am i loosing protein?",1
60 Day Keto Challenge,1
Nutritional label changes - carb question,1
Peanuts + X ( a nut or other plant with high percentage of protein) = complete protein,1
Is extreme hunger and an urge to overeat the body's natural response to calorie restriction?,1
"Which is the biggest dietary contribution to atherosclerosis - n-6 PUFAs, AGEs, refined sugar, fats in general or something else?",1
Did the introduction of industrial oils/refined sugar really lead to a significant increase in CVD? What did people eat pre-industrial oil/refined sugar?,1
Need advice on how to keep food down,1
Good Reads for Beginner,1
Always super hungry when only eating vegetables,1
I asked this community about psyllium a while ago and I came back with a personal feedback after trying them.,1
I'm looking for an updated nutrition database that tracks which foods are inflammatory and how much it affects inflammation,1
How to get rid of the feeling of hunger,1
Are chia seeds' nutrients only absorbed if they are chewed/ground before swallowing?,1
oil vs fried oil,1
Anti-inflammatory,1
"Hi, I'm really skinny and don't like most foods, most of my calories come from drinking a lot of milk, are their any supplements I should be taking to get essential nutrients on top of this?",1
"How can protein, fat, and carbs all be assumed to be the same number of calories?",1
Do you lose nutritional value from freezing fresh greens ?,1
"I hate Peanuts, what can I do to start liking them ?",1
"Does the strategy of eating 4 smaller meals spread out through the day, instead of 2 larger meals, actually work for dieting?",1
A bread that kind of sustains you,1
Where is a good place to find a nutritionist for consultation relating to animal feed production?,1
Looking for info on the Army internship,1
Unthaw whole chicken -&gt; Cook -&gt; Cut -&gt; Refreeze,1
Carbs = bad?,1
Overweight but can still see ribs?,1
Why do lattes have so many calories?,1
Please help..,1
Compose the ultimate sandwich. To cover all bases for your nutritional needs. What is your gastronomic creation?,1
How to eat more fiber?,1
glycemic index,1
