title,nutrition
Which one is better for taking for bodybuilding and joint health pure glycine or collagen,1
Using a blood sugar monitor to maximise fat loss?,1
Can you see if you are burning fat by doing blood sugar monitoring?,1
You are supposed to eat tumric with black pepper... What other little tricks should people know?,1
How to encourage coworker to eat better?,1
Coconut oil,1
Is pasta bad in moderation?,1
Rusty non-alloy cooking pots nutritionally superior?,1
Is it possible to get a lot of complex carbs in a diet while still eating healthy and staying under 2000 calories?,1
Is chicken breast overrated?,1
Is peanut butter a relatively healthy snack for throughout the day? And is it a good curb for hunger?,1
Achieving caloric deficit through diet vs exercise?,1
Is butter healthy,1
Veiny legs,1
Methyl Mercury and fish consumption,1
Brown Rice Serving,1
"assuming someone who rarely drinks , is drinking an alcoholic beverage on an empty stomach, and ate breakfast that morning, what foods or nutrients or substances would ......",1
"If there was 1 meal to eat for the rest of your life that contains everything you need in it, what is it?",1
I need help starting to eat better,1
Is there strong evidence that a diet high in fiber reduces the risk of appendicitis? How significant is this reduction?,1
Someone give me a quick pro and con of all sugar alternatives!!,1
What's the best way to gradually stop eating junk food without relapsing later on?,1
The 2 best veggies,1
Reintroducing Dairy,1
Eating a meal without meat makes my stomach feel hollow,1
Does hyrdrogenated palm oil stunt your growth,1
Dessicated Liver?,1
Cookbooks with macros,1
Is milk an important part of a child's diet?,1
Is it bad or ineffective to take two doses of vitamin D and B12 supplements every other day?,1
Kitchen Scale Recommendation,1
"If you eat a lot at once, does the body still digest it with the same efficiency?",1
How good is the research on supplements?,1
Is spaghetti and meatballs for lunch every day bad?,1
Advice on water enhancers,1
Best recommended cook books for meal prepping?,1
"I hold both an ATC and CSCS and work with high level atheltes, what is the most credible sports nutrition cert to add to my resume?",1
"If you didn't get your RDA of a nutrient one day, but got it the next day would it have any negative effects?",1
Does tea count as water?,1
Whey &amp; Acne,1
Do I need to supplement Vitamin D in the spring / summer months?,1
Nutrition when no thyroid?,1
Can you help me around out my girlfriend's diet,1
"Whey Isolate protein brand I can trust, that is also heavy metal free?",1
Greens in a pill.,1
Pan seared with canola vs deep fried?,1
Best supplements for fat loss?,1
Sugars,1
Health benefits of eating seafood outweigh negative health effects?,1
Chex Mix vs. Chex cereal (with recommended serving of milk) for breakfast?,1
I think I need some tips,1
Whats the best foods to eat during an 30day cut ?,1
Detox and Charcoal,1
whats your favourite way to top your carbs up to reach your quota if you're lacking at the end of the day (which I find I often am)?,1
Are bananas and mixed nuts a reasonable meal?,1
"Strictly from a nutritional point of view, is it OK for a kid to drink alcohol-free beer?",1
Association of changes in red meat consumption with total and cause specific mortality among US women and men: two prospective cohort studies,1
Diagnosed with vitamin A deficiency,1
Which vegetables are high in both fiber and protein?,1
How much is too much erythritol? What are long term effects?,1
Where do I look if I want to learn the health benefits of a food and not just the nutritional label?,1
Is it safe to eat a lot of fruits and veggies every day?,1
Healthy and Nutrient Rich Casseroles?,1
Omega 6 and nuts....,1
How much Canned Salmon/Sardines is safe in terms of mercury?,1
"Nutritionists, athletes and sugar",1
Refeeding,1
How to identify and avoid foods with sunflower oil?,1
Meat Dogma.,1
Need meal prep ideas,1
How long will sugar withdrawal last?,1
Sugar from fruits vs. processed sugars discussion,1
Looking for suggestions and recommendations!,1
"On every food item there's a little section that says ""sodium 6g, sugar 25g, cholesterol 5g,"" etc. What does all of that mean?",1
"What's more inflammatory, plant foods with high sugar content or low sugar gluten free gains?",1
"Science Friday: News in Nutrition (June 14, 2019) For discussion on the latest news and research in nutrition science",1
What's the healthiest thing on this menu?,1
water dehydrates me? Why i drink only frut juices.,1
What happens to our gut microbe when we have to take antibiotics?,1
Sauce jar or sache mix,1
Meat with healthy fats,1
Industries Funding Nutrition Research,1
Can someone clarify the nutritional value of this mass gainer. And is it good or not?,1
Could someone provide info on the effects of energy drinks in the morning/not eating breakfast / no appetite in the morning?,1
"Can potassium, magnesium and iron be taken together?",1
"If I use 1tbsp of tea when brewing my morning tea, is the amount of caffeine in half a cup of water the same as a full cup?",1
How much B3 is too much?,1
Best 13+ Food To Keep Eyes Healthy,1
Doc said smoking doesn’t affect cholesterol,1
Time-Restricted Eating to Prevent and Manage Chronic Metabolic Diseases,1
Always tired after eating healthy meals,1
Can fasting help with vein thrombosis? I am searching for nutrition related solution. Im wondering if there is any data/ research about fasting and it's influence on veins and circulation. Thanks,1
Water fasting?,1
Frozen Fruits and Vegetables Less Healthy?,1
Meat vs fruit,1
OMAD (One Meal A Day)?,1
Does plant milk retain most of the nutrients of the seeds/nuts etc is is made from?,1
Deep frying with light olive oil -- healthy or unhealthy?,1
"assuming someone who rarely drinks , is drinking an alcoholic beverage on an empty stomach, and ate breakfast that morning, what foods or nutrients or substances would ......",1
how do addicts get a good buzz if they are not eating enough to get enough iron zinc b-vitamins to make dopamine?,1
can you be deficient in iron without being tired? i have anhedonia. going to buy a iron supplement and take a little at first. ..,1
Injury recovery nutrition,1
why do some people sneeze after eating dark chocolate?,1
Are the bacteria still effective in commercial brand Kombucha?,1
Peanut butter and ??? Sandwich,1
"When the FDA ""Nutrition Facts"" label doesn't tell the whole story",1
Help with protein,1
Throughout the day or all at once?,1
Veggies throughout the day or all at once?,1
Nutrients in spinach - 15mins vs 1 hour boil?,1
What is a good amount of fat to intake daily?,1
What's a good vegetable rotation?,1
"Have any of you used a supplement daily for years? If so, what is it how has it affected you (negatively positively, or both)",1
"Has anybody used a supplement (preferably one not indicated for long term use) consistently for a long period of time? If so, what was it and how has it affected you?",1
What are your personal top foods for feeling full for hours?,1
"Myplate suggests half my daily food intakes should be fruits and vegetables. Does it mean ""half"" by calories or by volume?",1
Is it unhealthy to eat rice 3 times a day?,1
Foods highest in potassium,1
Iron deficiency,1
Milk substitute,1
Struggling to increase iron despite supplements,1
Contradictory viewpoints by people with different ways of eating/cherry-picking advice from the same sources.,1
"After green, what are the most important vegetable colors?",1
Anti-inflammatory diets - lots of anecdotal evidence backing both plant-based/vegan and low carb/carnivore. Any strong evidence/studies either way?,1
Low estrogen foods?,1
What replenishes glycogen stores during a very low carb diet?,1
ADA &amp; European Association Classify Low Carb Diets as Medical Nutrition Therapy,1
Is too much avocado bad for you?,1
"The /r/Nutrition Personal Nutrition Discussion Post (June 17, 2019) - All personal circumstance questions and evals pretaining to what you eat or might eat must use this post",1
"Anyone here ever try completely ""eating for energy"" rather than ""eating for pleasure (but healthy pleasurable meals)?",1
Is there currently any field of study in more disarray than nutrition?,1
Can i have some advise on what to eat/do if i'm below the BMI recommended numbers?,1
First time poster here - seeking advice as to how to bring about change.,1
Is there ant peanur butter without trans fats that are quite affordable (except the ones from supplement companies)?,1
Should Diet be Based around Daily Values?,1
Question: is this too much fruit? Is the amount of fruit I eat unhealthy?,1
RECOMMENDATION?,1
Nutritionally Perfect Day of Hitting All Nutrient Amounts?,1
I feel very overwhelmed by trying to get a balanced diet,1
What foods lower histamine or act as a antihistamine?,1
What foods lower histamine in the body?,1
Get rid of Dark Circles Naturally !!!,1
Ideal distribution of calories throughout a day?,1
"Does Chronometer take into account the ""inedible part"" of foods?",1
I know farm raised salmon can be bad to eat but do the health benefits out weight the negatives?,1
Micronutrient tracking,1
Mediterranean Diet: what are the macros?,1
I am upset that this subreddit is mostly just people asking questions and then comments being random answers without citations.,1
How to eat kefir without killing bacteria because of stomach acid?,1
Are Fruit Leathers Healthy,1
"Question regarding the ""set point weight""",1
Substitute for Greek yogurt &amp; Raw eggs in a mass gainer shake,1
How do high quality organic microwave meals stand up to their label vs what their marketing is implying? Are they as good as the homemade original if they don’t say they contain preservatives?,1
White beans .,1
Meat go with Diarys?,1
What supplements do you recommend for someone who has a plaque in an artery?,1
Protein in Microwaved Egg Whites,1
Why do I have a coughing fit after the first bite of a banana?,1
Is HMB (β-Hydroxy-β-methylbutyrate) effects really worth it?,1
"If calories are a measurement of energy, heat is also another form of energy. Does hot food contain more energy when consumed rather if it was cold?",1
Why does Ala have AI instead of rda?,1
Chia vs Flax Seeds,1
Please clear up an Overnight Oats calorie question for an Overthinker,1
How many apples a day is too many apples and is there a point they actually stop being good for you?,1
Getting enough nutrients on fully plant based diet??,1
Calorie confusion!!!!?!?!?,1
Cinnamon cassia extract,1
Flaxseeds - healthy or not?,1
Pickled Herring,1
Grass fed vs grain fed beef omega 3:6 and it’s impact on overall 3:6 ratios,1
Are drinks like Vitamin Water Zero healthy?,1
Protein shakes,1
"New scientific study on mitochondrial booster, Urolithin A (UA), shows supplement is safe, bioavailable and has promising mitochondrial, cellular and muscle health benefits for humans.",1
"[Research Discussion] First in human clinical study on mitochondrial booster and mitophagy activator, Urolithin A (UA).",1
Is this a good dinner?,1
Trying to get serious,1
"Difference between gelatin, gelatin hydrolysate and collagen hydrolysate? Which one is safer?",1
Why doesn't the nutrition label on some prepackaged kale list Vitamin A or Vitamin C?,1
Getting Enough Protein While Cutting,1
Is there a good book or website where I can learn basically everything I need to know about healthy eating?,1
How to eat on a mediterranean diet?,1
Egg question,1
is iogo yogurt healthy?,1
Low calories snacks sugar addiction,1
How to get the benefitial nutrition from garlic?,1
Low calories snacks ?,1
"{question} Whats the difference in nutrition and health benefits between: blueberries, strawberries and raspberries?",1
"Can't hit my protein goals, HELP!",1
How well does the digestive system cope with mixed inputs?,1
What are some good onlie ressources to learn about nutrition ?,1
Are grilled foods healthier than fried food?,1
So my girlfriend has this theory I would like an opinion on,1
"During fasting, does the body use or NOT use muscle protein for producing glycogen?",1
What is considered gluten? Im paralyzed.,1
Does eating little meat affect the microbiome as much as eating no meat?,1
Health benefits of coriander leaves,1
Is there a chart anywhere for seafood omega 3 content vs pollutant risk?,1
"Calculating macros in bulk cook, one pot meals.",1
List of 10 Essential Canine Amino Acids with Food Sources?,1
(question) is/how is 300 calories per serving of whole kernel corn legit?,1
"Are 'anti-inflammatory diets' a real, beneficial thing?",1
Sugar calories and calorie count,1
Hannaford Mini Monkey Bread Ingredients,1
Actual recommended protein?,1
I cannot digest zucchini and don’t know why,1
Does Vitamin D + Coral Calcium help with allergies?,1
Is coral calcium and vitamin D together a natural antihistamine?,1
[MYTH] Despite popular belief Potassium supplements are not limited by the FDA to only contain 99mg. I was surprised to see even a Harvard Medical School article was wrong about this.,1
Are some sources of protein better than others?,1
What are the macros to 1 slice of deli lunchmeat turkey?,1
Difference between basil seeds and chiA seeds,1
Best well rounded protein powder for weight loss?,1
What should I eat to avoid gallbladder issues?,1
Unbelievable That The Matrix 4 is coming up 2020.,1
My nutritional style,1
Any downsides on eating banana peels?,1
Leafy Green Soup? Cooking removes or denatures antinutrients?,1
Found a black hard rock-looking thing in my peanut butter... any idea what it is?,1
"Do drinks like coke zero, pepsi black, diet coke etc actually have 0 sugar and 0 cals? if yes, then what is the downside to such drinks?",1
How long does it take to feel well after taking Vitamin D supplements,1
A question about eating a healthy diet then eating unhealthy foods...,1
Is there something wrong with me?,1
Are citrucel and benefiber probiotics?,1
"Science Friday: News in Nutrition (June 21, 2019) For discussion on the latest news and research in nutrition science",1
"Impact of processed food on health, with proper care of micronutrients.",1
It’s the day before a morning weigh-in. What do you do to get rid of bloat and water weight?,1
What are the best possible things i could eat?,1
Just realized it after 38 years...,1
Are fat-soluble vitamins like vitamin A from fruits absorbed poorly without fats?,1
Does coffee deplete nutrients,1
Is Bolthouse juice healthy?,1
Cutting carbs to lower insulin sensetivity?,1
"How to figure out which ""anti-inflammatory diet"" is right for me?",1
Fish calories + sashimi calories,1
Coconut oil - good or bad?,1
Why do Nutritional Facts tags do not show all of the sugar contents?,1
The healthiest of foods.,1
"Extremely tired, joint pain after eating sweet potatoes",1
"If our glycogen stores magically never ran out, would our bodies use any fat for energy?",1
Is it ok to eat organic butter?,1
Are B-Complex vitamins safe for people who already get enough of them in their diet?,1
alcohol question,1
Take vitamins without fibers,1
A thought on nutritional supplements,1
How do you eat enough leafy vegetables when 60galone is like a jungle?,1
How do I get rid of my sugar cravings?,1
Homemade Bread Calories/Macros?,1
Using glucometer when eating out?,1
zinc and magnesium for T?,1
Is Pork 🐖 ACTUALLY as bad for you as religious groups claim?,1
How does one determine how much oil soaked into fried chicken?,1
Foods to eat for healthy hair?,1
How is calorie surplus/deficit calculated when the body does not recognize the concept of 24 hours?,1
What's the quickest way to gain FAT ?,1
How much lypocene is in 1 tbsp of tomato paste?,1
Nutrition Service Work Assignment,1
The impact of the sweet flavour on our body,1
Is Whey Inflammatory?,1
Carrageenan in toothpaste?,1
I'm an egg addict,1
"What are some foods that can keep my sperm ""thick"" while on NoFap?",1
The viability of a good omega-3/omega-6 ratio,1
How to sustainably change your diet without relapse?,1
"Who prefers drinking non-toxic/BPA water, any suggestions for glass flasks?",1
How is Keto considered healthy when it’s high in fat?,1
"male model or those with a lean proportionate physique, what is your diet like?",1
What are the best things you can do to help you improve your health?,1
How is it that “people are not eating enough fruits and vegetables” is true while “people don’t need to supplement their diet with a multivitamin” also true?,1
Gorillas follow a high fat diet. Should humans too?,1
"How much ""healthier"" really is home-cooked version of food when it uses the same ingredients as Frozen/Fast-Food.",1
"Is it better to weigh the food, or go by the grams of the nutrients?",1
Do you have any tips on how to not get sick?,1
Maximum absorbable doses of nutrients at one time?,1
Are humans naturally bad at digesting fructose?,1
Why do I wake up at 3 am and eat pre-shredded cheese?,1
Is DHA/EPA well absorbed from fish oil pills?,1
Do we all the sudden need to avoid every form of plastic in the grocery store because of microplastics?,1
Weighting meat before or after cooking it?,1
How do you have protein-heavy breakfasts when you don't have much time?,1
"The /r/Nutrition Personal Nutrition Discussion Post (June 24, 2019) - All personal circumstance questions and evals pretaining to what you eat or might eat must use this post",1
"What would be a single ""perfect"" meal for balanced nutrition if you wanna eat the same meal every day?",1
Dealing With Dietary Restrictions In The Backcountry.,1
Is it safe to eat cacao bean shells??,1
"Hey all! How do you calculate a maintenance calorie count? I’ve read that you multiply your weight by 12; however, I wanted to see if that sounded right.",1
Are refined carbs known to cause severe sleep disturbances?,1
Stimulants and overall health?,1
Are home made burgers as bad as fast food,1
Is beef collagen more easily digested than beef?,1
GMO Foods - what is the deal?,1
Trying to get 7 to 10 cups of vegetables a day without eating them,1
How can people survive overeating of junkfood?,1
Vegan experiencing receding gum,1
How much vitamin c can your body use?,1
How important are grains in one’s diet?,1
"The case for diet soda: It gets a bad rap, but the research tells a different story",1
How do you balance the cultural traditions of food and cooking with nutrition?,1
Omegas - SERIOUSLY?,1
Is it better to not eat tuna at all?,1
Alcohol and bladder,1
Can you wash off pesticides?,1
Is it pointless to take B12-supplements if you are already taking multivitamins?,1
Can I take whey protein powder on a slightly upset stomach?,1
Any apps that people reccomend for monotoring my nutrient intake while also suggesting what else I need,1
Diet suggestions after cardiac arrest due to blocked arteries?,1
Coffee with meals,1
"Does anyone know any good guides (especially videos) showing how to cook truly healthy foods, that hopefully don't cost a ton?",1
Hitting my macros with clean vs dirty food,1
Suggestions for high protein foods and snacks?,1
Hitting macros with clean vs dirty food,1
What's up with the hate for multivitamins? :(,1
Acid reflux after eating healthy...,1
Studies of dietary fat,1
Multivitamins/Supplements better than the real thing?,1
My friends Fitness/Health WordPress Blog,1
Recent interest in vitamins.,1
Anybody have experience with the Optavia Diet??,1
Why does the Paleo diet suggest not eating legumes?,1
What are some nutritious and cheap things a broke college student (me) can buy and reliably get nutrition from?,1
So I need some Options,1
Cheap lunch ideas?,1
Dr Andreas Eenfeldt - Changing perceptions – global impact of LCHF on health,1
How much caffeine is too much...,1
Are food sensitivity tests accurate?,1
Is putting almond extract in my coffee the same as putting alcohol into it?,1
Can your maintenance calories change depending on how active you are that week?,1
Do you still get the health benefits from chick peas when making homemade hummus?,1
Meal planner with macro and micronutrient tracker similar to Cronometer,1
"Are there any psychological effects to quitting drinking diet soda, and switching solely to water?",1
"Most organic energy/exercise supplement, from BCAA vs amino acid vs protein?",1
Heme iron is dangerous?,1
How do you get enough calories while eating well?,1
How bad are energy drinks likes such as monster?,1
"Lactase-like solution for countering gluten, casein, etc?",1
Can not eating resolve stomach issues? Such as gas bloating and constipation?,1
Looking for the best diet for a crippled picky eater,1
Prove to me that eating healthy is worth it.,1
Is there something I can access that informs people on basic nutrition?,1
Grain vs. legume vs. nut vs. seed?,1
Ketogenic Diet: Glucose and Lipid Homeostasis and Inflammation,1
What's the deal with Aspartame?,1
Would seitan still be considered a highly processed food if it is homemade?,1
Help with my diet please,1
Is BHT safe?,1
Food combining?,1
Best app for recipes for lean bulk?,1
Your go to healthy breakfast,1
"What do you think of the low fat, no carbohydrate diet that emphasizes protein that is used on the My 600 Pound Life show?",1
Small portabella mushrooms,1
"What's the difference between flaxseed oil,olive oil and other types of oil on salads?",1
Too much iron?,1
Never feel satiated?,1
Subscription Box Poll,1
"Is ""stevia baking powder"" (stevia extract + maltrodextrin) actually calorie-free?",1
Increased metabolism or slower metabolism for longevity?,1
Intermittent Fasting,1
Do Vitamin water Zeros hold any nutritional value?,1
Food based sources of Vitamin D?,1
"I'm a 17 M, barely eats fruits and vegetables, 115 pounds, and has the muscle mass of a Walnut and I'm trying to turn my life around.",1
Nutrition for energy and cognitive function,1
"Is 2 cups of raw, rolled oats per day too much?",1
"The /r/Nutrition Personal Nutrition Discussion Post (May 13, 2019) - All personal circumstance questions and evals pretaining to what you eat or might eat must use this post",1
Apple Cider Vinegar Healthier Than White Vinegar?,1
High protein/low carb meals,1
Does your body require a minimum amount of fish oil to actually realize any of its benefits?,1
That feeling when the organism doesn't digest...,1
Food Diary Apps,1
Beans and rice healthy?,1
Appropriate meal plan?,1
If you had to choose one: Diet Pepsi/Coke or Sugar Free Rockstar?,1
"Thoughts on Calorie Counting after Reading ""DEATH OF THE CALORIE""",1
Would it be worth to buy almond milk over dairy milk even though I'm not lactose intolerance or prone to breakouts?,1
Inflammatory and anti-inflammatory aminoacids?,1
Competing cases on the role of dietary protein in health and disease,1
Potassium Supplements,1
"Anyone know if the lining of canned foods is legitimately bad for you? Some say the BPA, etc. leeches into the food, others say it's negligible. Any studies/authoritative facts on this?",1
What are the healthiest dishes to order from a Chinese restaurant?,1
What are your views on teas?,1
Eating once a day,1
Does different grade of macha green tea have different level of benefits or is it just taste?,1
Thoughts on coconut milk?,1
How can a Five Guys burger contain so many calories?,1
What are your main science-backed reasons to consume or not milk?,1
Bioavailibility of B vitamins in energy drinks,1
10 Weight Loss Tips That Work If Diets Don’t Help Anymore,1
Legume Protein And Methionine,1
Optimal caloric amount for more efficient and better studying during exams?,1
"Is there even such a thing as a food that's ""good for you""? Why or why not",1
Is eating a lot of eggs a good way to bulk for building muscle?,1
Heavy whipping cream: Is Carrageenam and Guar Gum worth avoiding?,1
Apple Cider Vinegar Differences,1
Olive oil for cooking,1
Does boozy Kombucha have the same health benefits?,1
How to eat as healthy as possible?,1
"Keto, Paleo, Carb Cycling. Any thoughts?",1
"If fish oil does not protect against cardiovascular disease, why does fish?",1
String cheese,1
"Does all food lose nutrient value over time? As the nutrient value decreases, does something that is bad for you increase within the food (assuming it hasn't spoiled)? In my case, I'm wondering about this hemp protein that I have that has expired but tastes fine. I still have a lot of it left.",1
[Subreddit Update] - New discussion post category [Science Required],1
Your strategies for combatting nighttime hunger when on a caloric restriction?,1
What is considered healthy? Does cooking something a certain way make it lost all its nutritional value?,1
Nutritional breakfast ideas for people who hate breakfast?,1
Why are potassium supplements so incredibly tiny in comparison to the amount we need daily?,1
"What’s the order my body will burn/use carbs, protein, calories, and body fat?",1
Milk: Yay or Nay,1
Does the body have an adjustment phase when cutting?,1
Debt diet. List some go to meals that are nutritious and delicious but have simple and CHEAP ingredients.,1
"A few questions about how fat consumption affects a person's general, GI, brain, and skin health?",1
Is it true that insulin + protein stimulates mTor more than protein alone?,1
"Green tea, but not black tea, associated with successful ageing (2019)",1
Which kind of food is better for your digestive to stop having to fart ??,1
Is frozen cooked food less nutritious than regular cooked food?,1
Does milk interfere with Vitamin D supplements?,1
always tired and need to sleep,1
"What are healthy and good tasting drinks, one can drink on a daily basis?",1
"If carbohydrates use insulin to convert glucose into fat, how is the fat in 0g carb foods that require no insulin stored?",1
Help with the veggiesss please!,1
Do lutein and zeaxanthin supplements really promote eye health?,1
Is there an advised upper limit to consumption of egg whites?,1
Easy protein sources?,1
Is it true that the heat of the pan your using to cook the meat kills the becteria therefore there's no need to wash the meat.,1
